<?xml version="1.0" encoding="UTF-8"?>
<dataroot xmlns:od="urn:schemas-microsoft-com:officedata" xmlns:xsi="http://www.w3.org/2001/XMLSchema-instance"  xsi:noNamespaceSchemaLocation="disasters.xsd" generated="2007-05-04T14:26:03">
<disasters>
<key>dustbowl</key>
<frequency>0</frequency>
<season>both</season>
<one_year_warning>0</one_year_warning>
<linked_to_object>n</linked_to_object>
<climate_restriction>hot_dry</climate_restriction>
<minimum_scale>2</minimum_scale>
<maximum_scale>5</maximum_scale>
</disasters>
<disasters>
<key>earthquake</key>
<frequency>20</frequency>
<season>both</season>
<one_year_warning>0</one_year_warning>
<linked_to_object>n</linked_to_object>
<climate_restriction>n</climate_restriction>
<minimum_scale>2</minimum_scale>
<maximum_scale>5</maximum_scale>
</disasters>
<disasters>
<key>flood</key>
<frequency>10</frequency>
<season>summer</season>
<one_year_warning>0</one_year_warning>
<linked_to_object>rivers</linked_to_object>
<climate_restriction>n</climate_restriction>
<minimum_scale>2</minimum_scale>
<maximum_scale>5</maximum_scale>
</disasters>
<disasters>
<key>hurricane</key>
<frequency>10</frequency>
<season>summer</season>
<one_year_warning>0</one_year_warning>
<linked_to_object>n</linked_to_object>
<climate_restriction>tropical</climate_restriction>
<minimum_scale>2</minimum_scale>
<maximum_scale>5</maximum_scale>
</disasters>
<disasters>
<key>locusts</key>
<frequency>0</frequency>
<season>both</season>
<one_year_warning>0</one_year_warning>
<linked_to_object>n</linked_to_object>
<climate_restriction>hot_dry</climate_restriction>
<minimum_scale>2</minimum_scale>
<maximum_scale>5</maximum_scale>
</disasters>
<disasters>
<key>storm</key>
<frequency>4</frequency>
<season>both</season>
<one_year_warning>0</one_year_warning>
<linked_to_object>n</linked_to_object>
<climate_restriction>n</climate_restriction>
<minimum_scale>2</minimum_scale>
<maximum_scale>5</maximum_scale>
</disasters>
<disasters>
<key>volcano</key>
<frequency>50</frequency>
<season>both</season>
<one_year_warning>1</one_year_warning>
<linked_to_object>volcano</linked_to_object>
<climate_restriction>n</climate_restriction>
<minimum_scale>2</minimum_scale>
<maximum_scale>5</maximum_scale>
</disasters>
</dataroot>
